NEAT-project/neat,https://github.com/NEAT-project/neat,41,2016-02-22T13:19:59Z,2016-04-04T09:14:06Z,2016-04-07T09:13:19Z,MERGED,True,200,152,6,https://github.com/karlgrin,Karlgrin/he/feat,19,[],https://github.com/NEAT-project/neat/pull/41,https://github.com/karlgrin,1,https://github.com/NEAT-project/neat/pull/41,First prototype version of Happy Eyeballs. Is it ok to merge it with master branch?,First prototype version of Happy Eyeballs. Is it ok to merge it with master branch?,True,{}
NEAT-project/neat,https://github.com/NEAT-project/neat,41,2016-02-22T13:19:59Z,2016-04-04T09:14:06Z,2016-04-07T09:13:19Z,MERGED,True,200,152,6,https://github.com/karlgrin,Karlgrin/he/feat,19,[],https://github.com/NEAT-project/neat/pull/41,https://github.com/karlgrin,2,https://github.com/NEAT-project/neat/pull/41#issuecomment-191689883,First prototype version of Happy Eyeballs. Is it ok to merge it with master branch?,Have implemented a first version of HE that uses libuv (no threads). Would it be possible to merge this version with the master branch?,True,{}
NEAT-project/neat,https://github.com/NEAT-project/neat,41,2016-02-22T13:19:59Z,2016-04-04T09:14:06Z,2016-04-07T09:13:19Z,MERGED,True,200,152,6,https://github.com/karlgrin,Karlgrin/he/feat,19,[],https://github.com/NEAT-project/neat/pull/41,https://github.com/weinrank,3,https://github.com/NEAT-project/neat/pull/41#issuecomment-191709836,First prototype version of Happy Eyeballs. Is it ok to merge it with master branch?,"Valgrind reports memory leaks, can you fix them before merging?
http://buildbot.nplab.de:28010/waterfall",True,{}
NEAT-project/neat,https://github.com/NEAT-project/neat,41,2016-02-22T13:19:59Z,2016-04-04T09:14:06Z,2016-04-07T09:13:19Z,MERGED,True,200,152,6,https://github.com/karlgrin,Karlgrin/he/feat,19,[],https://github.com/NEAT-project/neat/pull/41,https://github.com/kristrev,4,https://github.com/NEAT-project/neat/pull/41#issuecomment-193473857,First prototype version of Happy Eyeballs. Is it ok to merge it with master branch?,"I have gone through the logic and even though I had some comments, but most of it is OK as a first version. However, there is one potential critical issue that should be fixed. It seems you always use the first successful connection. I guess this will in most cases make HE redundant, as the first connection to return will be v4/TCP. So that part should be redesigned a bit (see my comments in the code).
The other comment I have might be broader (and please bear in mind that I have lost a bit track of the callbacks). But I think a clearer split between server/client might be needed. For example, why do we call accept() in uvpollable_cb()? I guess a server will never do happy eyeballs (why should it?) and it looks weird to have an accept() check in a function called exclusively from a client. Maybe @tuexen can explain this better and tell me that I am completely lost.
Perhaps the easiest would be if we could all sit down tomorrow, and @karlgrin can give a quick overview of the current HE implementation and then we discuss it. Unfortunately, the most fit breakout session (topic 1) overlaps with the policy manager sessions (which I have to attend), but maybe we can find some time during the day anyway. There is the Wednesday WP2 slot, but then I guess you want to discuss the paper.",True,{}
NEAT-project/neat,https://github.com/NEAT-project/neat,41,2016-02-22T13:19:59Z,2016-04-04T09:14:06Z,2016-04-07T09:13:19Z,MERGED,True,200,152,6,https://github.com/karlgrin,Karlgrin/he/feat,19,[],https://github.com/NEAT-project/neat/pull/41,https://github.com/karlgrin,5,https://github.com/NEAT-project/neat/pull/41#issuecomment-205206295,First prototype version of Happy Eyeballs. Is it ok to merge it with master branch?,Merged HE after approval from Michael Tüxen.,True,{}
NEAT-project/neat,https://github.com/NEAT-project/neat,47,2016-04-11T09:05:56Z,2016-04-11T21:18:01Z,2016-04-25T14:16:24Z,MERGED,True,61,14,3,https://github.com/karlgrin,Issue #46 fixed. Put pack previously removed registration of poll han…,1,[],https://github.com/NEAT-project/neat/pull/47,https://github.com/karlgrin,1,https://github.com/NEAT-project/neat/pull/47,…dler routine and modified client application.,…dler routine and modified client application.,True,{}
NEAT-project/neat,https://github.com/NEAT-project/neat,47,2016-04-11T09:05:56Z,2016-04-11T21:18:01Z,2016-04-25T14:16:24Z,MERGED,True,61,14,3,https://github.com/karlgrin,Issue #46 fixed. Put pack previously removed registration of poll han…,1,[],https://github.com/NEAT-project/neat/pull/47,https://github.com/karlgrin,2,https://github.com/NEAT-project/neat/pull/47#issuecomment-208242189,…dler routine and modified client application.,Tried to fix issue #46.,True,{}
NEAT-project/neat,https://github.com/NEAT-project/neat,47,2016-04-11T09:05:56Z,2016-04-11T21:18:01Z,2016-04-25T14:16:24Z,MERGED,True,61,14,3,https://github.com/karlgrin,Issue #46 fixed. Put pack previously removed registration of poll han…,1,[],https://github.com/NEAT-project/neat/pull/47,https://github.com/karlgrin,3,https://github.com/NEAT-project/neat/pull/47#issuecomment-208360874,…dler routine and modified client application.,Sorry for the inconvenience.,True,{}
NEAT-project/neat,https://github.com/NEAT-project/neat,47,2016-04-11T09:05:56Z,2016-04-11T21:18:01Z,2016-04-25T14:16:24Z,MERGED,True,61,14,3,https://github.com/karlgrin,Issue #46 fixed. Put pack previously removed registration of poll han…,1,[],https://github.com/NEAT-project/neat/pull/47,https://github.com/weinrank,4,https://github.com/NEAT-project/neat/pull/47#issuecomment-208565930,…dler routine and modified client application.,lgtm,True,{}
NEAT-project/neat,https://github.com/NEAT-project/neat,48,2016-04-11T14:44:28Z,2016-04-19T15:13:17Z,2016-04-25T14:16:24Z,MERGED,True,29,2,3,https://github.com/karlgrin,Karlgrin/he/feat eh,3,[],https://github.com/NEAT-project/neat/pull/48,https://github.com/karlgrin,1,https://github.com/NEAT-project/neat/pull/48,Added some rudimentary error handling for Happy Eyeballs. Maybe this will suffice until NEAT Logic etc. have been implemented.,Added some rudimentary error handling for Happy Eyeballs. Maybe this will suffice until NEAT Logic etc. have been implemented.,True,{}
NEAT-project/neat,https://github.com/NEAT-project/neat,49,2016-04-12T12:57:12Z,2016-04-12T12:57:15Z,2016-04-12T12:57:15Z,MERGED,True,34,2,9,https://github.com/weinrank,Adobt callback semantic from 94aec76 to all other samples,1,[],https://github.com/NEAT-project/neat/pull/49,https://github.com/weinrank,1,https://github.com/NEAT-project/neat/pull/49,,,True,{}
NEAT-project/neat,https://github.com/NEAT-project/neat,50,2016-04-12T13:36:47Z,2016-04-12T14:10:06Z,2016-04-12T14:10:06Z,MERGED,True,232,29,6,https://github.com/weinrank,Add basic logging functionality,7,[],https://github.com/NEAT-project/neat/pull/50,https://github.com/weinrank,1,https://github.com/NEAT-project/neat/pull/50,"Introduce basic logging functionality, controllable via environment variables","Introduce basic logging functionality, controllable via environment variables",True,{}
NEAT-project/neat,https://github.com/NEAT-project/neat,51,2016-04-12T13:42:19Z,2016-04-12T13:42:36Z,2016-04-27T12:57:20Z,MERGED,True,826,39,10,https://github.com/ruengeler,Add usrSCTP support,1,[],https://github.com/NEAT-project/neat/pull/51,https://github.com/ruengeler,1,https://github.com/NEAT-project/neat/pull/51,,,True,{}
NEAT-project/neat,https://github.com/NEAT-project/neat,51,2016-04-12T13:42:19Z,2016-04-12T13:42:36Z,2016-04-27T12:57:20Z,MERGED,True,826,39,10,https://github.com/ruengeler,Add usrSCTP support,1,[],https://github.com/NEAT-project/neat/pull/51,https://github.com/tuexen,2,https://github.com/NEAT-project/neat/pull/51#issuecomment-208972265,,Hmm. I would expect that all the neat examples just work. Without anything special related the the usrsctp stack. This should be covered completely within the neat library.,True,{}
NEAT-project/neat,https://github.com/NEAT-project/neat,52,2016-04-13T10:36:25Z,2016-04-13T10:40:34Z,2016-04-13T10:40:35Z,MERGED,True,323,25,8,https://github.com/kristrev,Read resolv conf,6,[],https://github.com/NEAT-project/neat/pull/52,https://github.com/kristrev,1,https://github.com/NEAT-project/neat/pull/52,"Read DNS servers from resolv.conf. Supplement with some public DNS servers. Async monitoring of resolv.conf in case interfaces are connected/disconnected.
I see build-bot failures, but they seem not to be connected to this code (rather bug in HE + Felix' no resolv error report).","Read DNS servers from resolv.conf. Supplement with some public DNS servers. Async monitoring of resolv.conf in case interfaces are connected/disconnected.
I see build-bot failures, but they seem not to be connected to this code (rather bug in HE + Felix' no resolv error report).",True,{}
NEAT-project/neat,https://github.com/NEAT-project/neat,53,2016-04-13T12:38:51Z,2016-04-13T14:43:52Z,2016-04-13T14:43:52Z,MERGED,True,227,367,17,https://github.com/weinrank,Extend debug functionality,10,[],https://github.com/NEAT-project/neat/pull/53,https://github.com/weinrank,1,https://github.com/NEAT-project/neat/pull/53,,,True,{}
NEAT-project/neat,https://github.com/NEAT-project/neat,54,2016-04-13T14:48:09Z,2016-04-13T14:48:14Z,2016-04-13T14:48:14Z,MERGED,True,33,0,1,https://github.com/kristrev,Bind socket to iface,5,[],https://github.com/NEAT-project/neat/pull/54,https://github.com/kristrev,1,https://github.com/NEAT-project/neat/pull/54,"We need to bind socket to address/interface in neat_connect_via_kernel(), otherwise everything is void wrt multihoming. The approach probably needs to be refined for SCTP/MPTCP, since I don't quite know how they react to explicit bind.","We need to bind socket to address/interface in neat_connect_via_kernel(), otherwise everything is void wrt multihoming. The approach probably needs to be refined for SCTP/MPTCP, since I don't quite know how they react to explicit bind.",True,{}
NEAT-project/neat,https://github.com/NEAT-project/neat,55,2016-04-13T16:15:56Z,2016-04-13T16:15:59Z,2016-04-28T11:51:07Z,MERGED,True,4,6,2,https://github.com/weinrank,Add debug output and revert a temporary change in neat_he,2,[],https://github.com/NEAT-project/neat/pull/55,https://github.com/weinrank,1,https://github.com/NEAT-project/neat/pull/55,,,True,{}
NEAT-project/neat,https://github.com/NEAT-project/neat,56,2016-04-18T09:33:34Z,2016-04-27T12:56:46Z,2016-04-27T12:57:16Z,CLOSED,False,379,518,9,https://github.com/ruengeler,Use upcall callback for usrsctp,1,[],https://github.com/NEAT-project/neat/pull/56,https://github.com/ruengeler,1,https://github.com/NEAT-project/neat/pull/56,Changed callback from receive/send cb to upcalls to get on_readable and on_writable.,Changed callback from receive/send cb to upcalls to get on_readable and on_writable.,True,{}
NEAT-project/neat,https://github.com/NEAT-project/neat,57,2016-04-18T14:46:06Z,2016-04-18T15:06:52Z,2016-04-18T15:06:52Z,MERGED,True,358,237,10,https://github.com/weinrank,samples refactoring,10,[],https://github.com/NEAT-project/neat/pull/57,https://github.com/weinrank,1,https://github.com/NEAT-project/neat/pull/57,@ruengeler @tuexen,@ruengeler @tuexen,True,{}
NEAT-project/neat,https://github.com/NEAT-project/neat,60,2016-04-21T15:04:19Z,2016-04-21T15:04:44Z,2016-04-28T11:51:19Z,MERGED,True,414,371,16,https://github.com/weinrank,Samples refactoring,9,[],https://github.com/NEAT-project/neat/pull/60,https://github.com/weinrank,1,https://github.com/NEAT-project/neat/pull/60,,,True,{}
NEAT-project/neat,https://github.com/NEAT-project/neat,61,2016-04-21T23:43:57Z,2016-04-23T08:37:29Z,2016-04-28T11:51:26Z,MERGED,True,44,54,17,https://github.com/weinrank,neat_open + neat_accept : use integer instead of string ,2,[],https://github.com/NEAT-project/neat/pull/61,https://github.com/weinrank,1,https://github.com/NEAT-project/neat/pull/61,neat_open + neat_accept : use integer instead of string as port/service parameter,neat_open + neat_accept : use integer instead of string as port/service parameter,True,{}
NEAT-project/neat,https://github.com/NEAT-project/neat,62,2016-04-22T08:25:15Z,2016-04-25T15:17:16Z,2016-04-25T15:17:16Z,CLOSED,False,122,58,7,https://github.com/weinrank,Fix sa_len + sin_len errors for *BSD - RFC,12,[],https://github.com/NEAT-project/neat/pull/62,https://github.com/weinrank,1,https://github.com/NEAT-project/neat/pull/62,@tuexen ?,@tuexen ?,True,{}
NEAT-project/neat,https://github.com/NEAT-project/neat,62,2016-04-22T08:25:15Z,2016-04-25T15:17:16Z,2016-04-25T15:17:16Z,CLOSED,False,122,58,7,https://github.com/weinrank,Fix sa_len + sin_len errors for *BSD - RFC,12,[],https://github.com/NEAT-project/neat/pull/62,https://github.com/weinrank,2,https://github.com/NEAT-project/neat/pull/62#issuecomment-214281839,@tuexen ?,"push
I also added the ""-pedantic"" flag to the compiler options and fixed related compile errors.",True,{}
NEAT-project/neat,https://github.com/NEAT-project/neat,63,2016-04-25T12:43:30Z,2016-04-25T13:50:35Z,2016-04-25T13:50:35Z,MERGED,True,301,54,23,https://github.com/weinrank,Updated README.md and first api documentation draft,24,[],https://github.com/NEAT-project/neat/pull/63,https://github.com/weinrank,1,https://github.com/NEAT-project/neat/pull/63,,,True,{'THUMBS_UP': ['https://github.com/NTag']}
NEAT-project/neat,https://github.com/NEAT-project/neat,64,2016-04-25T14:14:16Z,2016-04-25T15:17:00Z,2016-05-01T10:02:42Z,MERGED,True,11,2,1,https://github.com/karlgrin,"Fixed issue #59 - SIGSEGV, segmentation fault.",1,[],https://github.com/NEAT-project/neat/pull/64,https://github.com/karlgrin,1,https://github.com/NEAT-project/neat/pull/64,"Fixed issue #59 - ""When running neat_http_get with an unresolvable DNS name, there is an segfault error.""","Fixed issue #59 - ""When running neat_http_get with an unresolvable DNS name, there is an segfault error.""",True,{}
NEAT-project/neat,https://github.com/NEAT-project/neat,65,2016-04-25T15:27:50Z,2016-04-25T15:33:08Z,2016-04-28T11:50:30Z,MERGED,True,104,45,4,https://github.com/weinrank,Set sin_len + sa_len on BSD-like systems,8,[],https://github.com/NEAT-project/neat/pull/65,https://github.com/weinrank,1,https://github.com/NEAT-project/neat/pull/65,,,True,{}
NEAT-project/neat,https://github.com/NEAT-project/neat,66,2016-04-25T16:56:01Z,2016-04-25T17:05:03Z,2016-04-28T11:50:40Z,CLOSED,False,139,88,10,https://github.com/weinrank,"C-Flags: use c99 std and add ""-pedantic""",8,[],https://github.com/NEAT-project/neat/pull/66,https://github.com/weinrank,1,https://github.com/NEAT-project/neat/pull/66,,,True,{}
NEAT-project/neat,https://github.com/NEAT-project/neat,66,2016-04-25T16:56:01Z,2016-04-25T17:05:03Z,2016-04-28T11:50:40Z,CLOSED,False,139,88,10,https://github.com/weinrank,"C-Flags: use c99 std and add ""-pedantic""",8,[],https://github.com/NEAT-project/neat/pull/66,https://github.com/tuexen,2,https://github.com/NEAT-project/neat/pull/66#issuecomment-214442655,,Doesn't this patch mixes the stricter compilation options with the handling of the sin_len fields?,True,{}
NEAT-project/neat,https://github.com/NEAT-project/neat,66,2016-04-25T16:56:01Z,2016-04-25T17:05:03Z,2016-04-28T11:50:40Z,CLOSED,False,139,88,10,https://github.com/weinrank,"C-Flags: use c99 std and add ""-pedantic""",8,[],https://github.com/NEAT-project/neat/pull/66,https://github.com/weinrank,3,https://github.com/NEAT-project/neat/pull/66#issuecomment-214443311,,"Yeah, sorry...",True,{}
NEAT-project/neat,https://github.com/NEAT-project/neat,67,2016-04-25T17:14:22Z,2016-04-25T21:36:32Z,2016-04-28T11:50:51Z,MERGED,True,41,49,10,https://github.com/weinrank,"C-Flags: use c99 std and add ""-pedantic""",10,[],https://github.com/NEAT-project/neat/pull/67,https://github.com/weinrank,1,https://github.com/NEAT-project/neat/pull/67,"@tuexen This is a ""clean"" version of the patch without the previously merged branch","@tuexen This is a ""clean"" version of the patch without the previously merged branch",True,{}
NEAT-project/neat,https://github.com/NEAT-project/neat,67,2016-04-25T17:14:22Z,2016-04-25T21:36:32Z,2016-04-28T11:50:51Z,MERGED,True,41,49,10,https://github.com/weinrank,"C-Flags: use c99 std and add ""-pedantic""",10,[],https://github.com/NEAT-project/neat/pull/67,https://github.com/tuexen,2,https://github.com/NEAT-project/neat/pull/67#issuecomment-214449936,"@tuexen This is a ""clean"" version of the patch without the previously merged branch",Address the nits and merge it.,True,{}
NEAT-project/neat,https://github.com/NEAT-project/neat,68,2016-04-28T22:19:23Z,2016-04-28T22:19:28Z,2016-04-28T22:19:28Z,MERGED,True,7,2,2,https://github.com/weinrank,fix valgrind errors,3,[],https://github.com/NEAT-project/neat/pull/68,https://github.com/weinrank,1,https://github.com/NEAT-project/neat/pull/68,,,True,{}
NEAT-project/neat,https://github.com/NEAT-project/neat,69,2016-05-02T07:52:56Z,2016-05-02T07:53:46Z,2016-06-16T15:49:26Z,MERGED,True,448,289,10,https://github.com/ruengeler,With usrsctp,7,[],https://github.com/NEAT-project/neat/pull/69,https://github.com/ruengeler,1,https://github.com/NEAT-project/neat/pull/69,Support for usrsctp.,Support for usrsctp.,True,{}
NEAT-project/neat,https://github.com/NEAT-project/neat,69,2016-05-02T07:52:56Z,2016-05-02T07:53:46Z,2016-06-16T15:49:26Z,MERGED,True,448,289,10,https://github.com/ruengeler,With usrsctp,7,[],https://github.com/NEAT-project/neat/pull/69,https://github.com/weinrank,2,https://github.com/NEAT-project/neat/pull/69#issuecomment-216128176,Support for usrsctp.,"FYI: I changed the CMake file to not include usrsctp support by default -  c394c55
We have compile errors on netbsd and ubuntu:
http://buildbot.nplab.de:28010/builders/netbsd/builds/14/steps/compile/logs/stdio
http://buildbot.nplab.de:28010/builders/ubuntu-16.04/builds/17/steps/compile/logs/stdio",True,{}
NEAT-project/neat,https://github.com/NEAT-project/neat,70,2016-05-02T08:58:02Z,2016-05-02T08:58:10Z,2016-05-02T09:29:48Z,MERGED,True,10,8,3,https://github.com/ruengeler,Fix compiler warnings and address Michael's comments,1,[],https://github.com/NEAT-project/neat/pull/70,https://github.com/ruengeler,1,https://github.com/NEAT-project/neat/pull/70,,,True,{}
NEAT-project/neat,https://github.com/NEAT-project/neat,71,2016-05-02T12:00:46Z,2016-05-02T12:01:05Z,2016-06-16T15:49:30Z,MERGED,True,15,15,2,https://github.com/ruengeler,Do not define IPPROTO_SCTP,1,[],https://github.com/NEAT-project/neat/pull/71,https://github.com/ruengeler,1,https://github.com/NEAT-project/neat/pull/71,,,True,{}
NEAT-project/neat,https://github.com/NEAT-project/neat,72,2016-05-02T13:36:11Z,2016-05-02T13:36:19Z,2016-05-02T13:36:19Z,MERGED,True,11,3,1,https://github.com/weinrank,http_client: GET URI via argument,2,[],https://github.com/NEAT-project/neat/pull/72,https://github.com/weinrank,1,https://github.com/NEAT-project/neat/pull/72,,,True,{}
NEAT-project/neat,https://github.com/NEAT-project/neat,73,2016-05-02T13:55:58Z,2016-05-02T13:56:01Z,2016-06-07T11:19:16Z,MERGED,True,1,1,1,https://github.com/weinrank,fix netbsd compile error,1,[],https://github.com/NEAT-project/neat/pull/73,https://github.com/weinrank,1,https://github.com/NEAT-project/neat/pull/73,,,True,{}
NEAT-project/neat,https://github.com/NEAT-project/neat,74,2016-05-02T14:35:51Z,2016-05-02T17:40:28Z,2016-06-07T11:19:06Z,MERGED,True,10,3,2,https://github.com/weinrank,fix valgrind issues for ipv6,4,[],https://github.com/NEAT-project/neat/pull/74,https://github.com/weinrank,1,https://github.com/NEAT-project/neat/pull/74,,,True,{}
NEAT-project/neat,https://github.com/NEAT-project/neat,76,2016-05-03T15:46:27Z,2016-05-04T14:42:08Z,2016-05-27T06:43:57Z,CLOSED,False,61,65,5,https://github.com/karlgrin,Karlgrin/issue #58,2,[],https://github.com/NEAT-project/neat/pull/76,https://github.com/karlgrin,1,https://github.com/NEAT-project/neat/pull/76,,,True,{}
NEAT-project/neat,https://github.com/NEAT-project/neat,76,2016-05-03T15:46:27Z,2016-05-04T14:42:08Z,2016-05-27T06:43:57Z,CLOSED,False,61,65,5,https://github.com/karlgrin,Karlgrin/issue #58,2,[],https://github.com/NEAT-project/neat/pull/76,https://github.com/karlgrin,2,https://github.com/NEAT-project/neat/pull/76#issuecomment-216572518,,Maybe #75 is still outstanding. Need to check this more thoroughly.,True,{}
NEAT-project/neat,https://github.com/NEAT-project/neat,76,2016-05-03T15:46:27Z,2016-05-04T14:42:08Z,2016-05-27T06:43:57Z,CLOSED,False,61,65,5,https://github.com/karlgrin,Karlgrin/issue #58,2,[],https://github.com/NEAT-project/neat/pull/76,https://github.com/weinrank,3,https://github.com/NEAT-project/neat/pull/76#issuecomment-216572889,,"PR isn't mergeable, please resolve conflicts before merge",True,{}
NEAT-project/neat,https://github.com/NEAT-project/neat,76,2016-05-03T15:46:27Z,2016-05-04T14:42:08Z,2016-05-27T06:43:57Z,CLOSED,False,61,65,5,https://github.com/karlgrin,Karlgrin/issue #58,2,[],https://github.com/NEAT-project/neat/pull/76,https://github.com/weinrank,4,https://github.com/NEAT-project/neat/pull/76#issuecomment-216701538,,"I tried to integrate your changes into the current master branch which caused some problems especially with use-after-free errors.
I suggest that you fix the issues in two steps within a branch of the current master to get a clean solution.",True,{}
NEAT-project/neat,https://github.com/NEAT-project/neat,76,2016-05-03T15:46:27Z,2016-05-04T14:42:08Z,2016-05-27T06:43:57Z,CLOSED,False,61,65,5,https://github.com/karlgrin,Karlgrin/issue #58,2,[],https://github.com/NEAT-project/neat/pull/76,https://github.com/karlgrin,5,https://github.com/NEAT-project/neat/pull/76#issuecomment-216758908,,BTW did HE between SCTP and TCP work (Issue #75)?,True,{}
NEAT-project/neat,https://github.com/NEAT-project/neat,76,2016-05-03T15:46:27Z,2016-05-04T14:42:08Z,2016-05-27T06:43:57Z,CLOSED,False,61,65,5,https://github.com/karlgrin,Karlgrin/issue #58,2,[],https://github.com/NEAT-project/neat/pull/76,https://github.com/weinrank,6,https://github.com/NEAT-project/neat/pull/76#issuecomment-216766516,,"Regardless of errors: Yes!
http://buildbot.nplab.de:28010/waterfall?branch=weinrank/he_fix
There you see three runs - the second one corresponds to your changes.
FreeBSD-ARM fails and also Ubuntu with IPv6 but it's better than before.",True,{}
NEAT-project/neat,https://github.com/NEAT-project/neat,77,2016-05-04T14:45:30Z,2016-05-26T08:10:52Z,2016-05-27T06:44:09Z,MERGED,True,62,51,4,https://github.com/karlgrin,Issue #58: New attempt to fix memory leaks due to HE.,1,[],https://github.com/NEAT-project/neat/pull/77,https://github.com/karlgrin,1,https://github.com/NEAT-project/neat/pull/77,"Have tried to fix memory leak due to HE. Think it should work with TCP and kernel SCTP, however, usrsctp probably needs some code in function neat_socket_2().","Have tried to fix memory leak due to HE. Think it should work with TCP and kernel SCTP, however, usrsctp probably needs some code in function neat_socket_2().",True,{}
NEAT-project/neat,https://github.com/NEAT-project/neat,77,2016-05-04T14:45:30Z,2016-05-26T08:10:52Z,2016-05-27T06:44:09Z,MERGED,True,62,51,4,https://github.com/karlgrin,Issue #58: New attempt to fix memory leaks due to HE.,1,[],https://github.com/NEAT-project/neat/pull/77,https://github.com/weinrank,2,https://github.com/NEAT-project/neat/pull/77#issuecomment-216890374,"Have tried to fix memory leak due to HE. Think it should work with TCP and kernel SCTP, however, usrsctp probably needs some code in function neat_socket_2().","No, still leaks and Failures, see Buildbots...",True,{}
NEAT-project/neat,https://github.com/NEAT-project/neat,77,2016-05-04T14:45:30Z,2016-05-26T08:10:52Z,2016-05-27T06:44:09Z,MERGED,True,62,51,4,https://github.com/karlgrin,Issue #58: New attempt to fix memory leaks due to HE.,1,[],https://github.com/NEAT-project/neat/pull/77,https://github.com/weinrank,3,https://github.com/NEAT-project/neat/pull/77#issuecomment-216891984,"Have tried to fix memory leak due to HE. Think it should work with TCP and kernel SCTP, however, usrsctp probably needs some code in function neat_socket_2().",http://buildbot.nplab.de:28010/waterfall?branch=karlgrin%2Fissue_%2358_2,True,{}
NEAT-project/neat,https://github.com/NEAT-project/neat,77,2016-05-04T14:45:30Z,2016-05-26T08:10:52Z,2016-05-27T06:44:09Z,MERGED,True,62,51,4,https://github.com/karlgrin,Issue #58: New attempt to fix memory leaks due to HE.,1,[],https://github.com/NEAT-project/neat/pull/77,https://github.com/karlgrin,4,https://github.com/NEAT-project/neat/pull/77#issuecomment-216896655,"Have tried to fix memory leak due to HE. Think it should work with TCP and kernel SCTP, however, usrsctp probably needs some code in function neat_socket_2().","It seems that it behaves quite differently on different platforms. Maybe it would be easier if I could ge access to some of these systems so that I could run them locally. The thing is that it neat_http_get seems
to be working ok on Ubuntu 15.10 (the version used on my test machine).",True,{}
NEAT-project/neat,https://github.com/NEAT-project/neat,79,2016-05-10T12:40:27Z,2016-05-10T13:54:18Z,2016-06-07T11:18:52Z,MERGED,True,232,722,19,https://github.com/weinrank,Samples refactoring,21,[],https://github.com/NEAT-project/neat/pull/79,https://github.com/weinrank,1,https://github.com/NEAT-project/neat/pull/79,"divide samples into examples and tests
CMAKE refactoring
samples documentation
cleanup","divide samples into examples and tests
CMAKE refactoring
samples documentation
cleanup",True,{}
