NovaMods/nova-renderer,https://github.com/NovaMods/nova-renderer,3,2016-06-04T00:30:46Z,2016-06-06T15:48:52Z,2016-06-30T00:53:10Z,MERGED,True,7,0,1,https://github.com/SylveonBottle,Create CONTRIBUTING.md,1,[],https://github.com/NovaMods/nova-renderer/pull/3,https://github.com/SylveonBottle,1,https://github.com/NovaMods/nova-renderer/pull/3,"Please click ""Files Changed"" above this box, and click ""View"" on the right side to see what I've done.","Please click ""Files Changed"" above this box, and click ""View"" on the right side to see what I've done.",True,{}
NovaMods/nova-renderer,https://github.com/NovaMods/nova-renderer,3,2016-06-04T00:30:46Z,2016-06-06T15:48:52Z,2016-06-30T00:53:10Z,MERGED,True,7,0,1,https://github.com/SylveonBottle,Create CONTRIBUTING.md,1,[],https://github.com/NovaMods/nova-renderer/pull/3,https://github.com/VoyTechnology,2,https://github.com/NovaMods/nova-renderer/pull/3#issuecomment-224097597,"Please click ""Files Changed"" above this box, and click ""View"" on the right side to see what I've done.","Just a hint, when making a pull request that directly addresses an issue, in the description write
Closes #2
This (should) automatically close the related issue when a PR is merged :)",True,{}
NovaMods/nova-renderer,https://github.com/NovaMods/nova-renderer,4,2016-06-06T21:51:02Z,2016-06-07T00:11:42Z,2016-06-30T00:53:09Z,MERGED,True,5,2,2,https://github.com/VoyTechnology,Minor changes to the markdown files,1,[],https://github.com/NovaMods/nova-renderer/pull/4,https://github.com/VoyTechnology,1,https://github.com/NovaMods/nova-renderer/pull/4,These are minor typos in the Contributing file. I also added a heading for Installation which is currently missing,These are minor typos in the Contributing file. I also added a heading for Installation which is currently missing,True,{}
NovaMods/nova-renderer,https://github.com/NovaMods/nova-renderer,9,2016-06-17T18:36:35Z,2016-07-06T03:06:19Z,2016-07-06T03:06:20Z,MERGED,True,30090,4054,53,https://github.com/mdsitton,"Clean up the cmake build system, and get it building on linux.",9,[],https://github.com/NovaMods/nova-renderer/pull/9,https://github.com/mdsitton,1,https://github.com/NovaMods/nova-renderer/pull/9,Building on windows needs to be tested though. This will fix issue #6.,Building on windows needs to be tested though. This will fix issue #6.,True,{}
NovaMods/nova-renderer,https://github.com/NovaMods/nova-renderer,9,2016-06-17T18:36:35Z,2016-07-06T03:06:19Z,2016-07-06T03:06:20Z,MERGED,True,30090,4054,53,https://github.com/mdsitton,"Clean up the cmake build system, and get it building on linux.",9,[],https://github.com/NovaMods/nova-renderer/pull/9,https://github.com/mdsitton,2,https://github.com/NovaMods/nova-renderer/pull/9#issuecomment-226850830,Building on windows needs to be tested though. This will fix issue #6.,"There is also still some issues that need to be sorted out. For example if you want to attempt to run the genered binary you need to move it out of the src sub directory into top build folder (you should probably run cmake within the build folder but still is within a sub src folder)
Another issue currently it builds most of the files twice since it builds the shared library, and the test executable. Ideally we would want to have the test just link against the shared library, but i havent quite figured out how to do this yet.
I'd also like to move the files in git that are within the build directory somewhere else, then do a cmake custom command to copy them into the build folder after the build is done. But i will need to consult with @DethRaid where he would want to put them.",True,{}
NovaMods/nova-renderer,https://github.com/NovaMods/nova-renderer,9,2016-06-17T18:36:35Z,2016-07-06T03:06:19Z,2016-07-06T03:06:20Z,MERGED,True,30090,4054,53,https://github.com/mdsitton,"Clean up the cmake build system, and get it building on linux.",9,[],https://github.com/NovaMods/nova-renderer/pull/9,https://github.com/mdsitton,3,https://github.com/NovaMods/nova-renderer/pull/9#issuecomment-226870301,Building on windows needs to be tested though. This will fix issue #6.,Ok so most of that last comment is fixed. Only issue is i'd still like to move those files out of the build directory and maybe into sub project specific folders. so move build/test to src/test/runtime or something.,True,{}
NovaMods/nova-renderer,https://github.com/NovaMods/nova-renderer,9,2016-06-17T18:36:35Z,2016-07-06T03:06:19Z,2016-07-06T03:06:20Z,MERGED,True,30090,4054,53,https://github.com/mdsitton,"Clean up the cmake build system, and get it building on linux.",9,[],https://github.com/NovaMods/nova-renderer/pull/9,https://github.com/mdsitton,4,https://github.com/NovaMods/nova-renderer/pull/9#issuecomment-226870401,Building on windows needs to be tested though. This will fix issue #6.,This all still needs testing on windows though.,True,{}
NovaMods/nova-renderer,https://github.com/NovaMods/nova-renderer,9,2016-06-17T18:36:35Z,2016-07-06T03:06:19Z,2016-07-06T03:06:20Z,MERGED,True,30090,4054,53,https://github.com/mdsitton,"Clean up the cmake build system, and get it building on linux.",9,[],https://github.com/NovaMods/nova-renderer/pull/9,https://github.com/mdsitton,5,https://github.com/NovaMods/nova-renderer/pull/9#issuecomment-226871824,Building on windows needs to be tested though. This will fix issue #6.,For now i just moved the nova-test output directory to be inside the test folder so that nova-test can properly find the shaders.,True,{}
NovaMods/nova-renderer,https://github.com/NovaMods/nova-renderer,9,2016-06-17T18:36:35Z,2016-07-06T03:06:19Z,2016-07-06T03:06:20Z,MERGED,True,30090,4054,53,https://github.com/mdsitton,"Clean up the cmake build system, and get it building on linux.",9,[],https://github.com/NovaMods/nova-renderer/pull/9,https://github.com/mdsitton,6,https://github.com/NovaMods/nova-renderer/pull/9#issuecomment-226872732,Building on windows needs to be tested though. This will fix issue #6.,"So currently the build of nova-test will not be relocatable outside of the build folder(on linux atleast). I'll need to setup the value INSTALL_RPATH so that the library can be found relative to the executable when ""installing"" though i haven't quite figured this out yet. Though this wont be relativent for the shared library though only the executable that links to it.",True,{}
NovaMods/nova-renderer,https://github.com/NovaMods/nova-renderer,9,2016-06-17T18:36:35Z,2016-07-06T03:06:19Z,2016-07-06T03:06:20Z,MERGED,True,30090,4054,53,https://github.com/mdsitton,"Clean up the cmake build system, and get it building on linux.",9,[],https://github.com/NovaMods/nova-renderer/pull/9,https://github.com/mdsitton,7,https://github.com/NovaMods/nova-renderer/pull/9#issuecomment-226940847,Building on windows needs to be tested though. This will fix issue #6.,"Rebased ontop of current master (thats why comments are a bit weird and out of place now)
I mentioned some of the issues with doing the GLFW build from our cmake.I've stayed up quite late and need to get to sleep. I'll implement the least annoying method when i wake up.",True,{}
NovaMods/nova-renderer,https://github.com/NovaMods/nova-renderer,9,2016-06-17T18:36:35Z,2016-07-06T03:06:19Z,2016-07-06T03:06:20Z,MERGED,True,30090,4054,53,https://github.com/mdsitton,"Clean up the cmake build system, and get it building on linux.",9,[],https://github.com/NovaMods/nova-renderer/pull/9,https://github.com/DethRaid,8,https://github.com/NovaMods/nova-renderer/pull/9#issuecomment-228136126,Building on windows needs to be tested though. This will fix issue #6.,Glancing at the code this looks good. I'll have to pull it locally and test it on my machine when I get home from work. How close to done do you think you are?,True,{}
NovaMods/nova-renderer,https://github.com/NovaMods/nova-renderer,9,2016-06-17T18:36:35Z,2016-07-06T03:06:19Z,2016-07-06T03:06:20Z,MERGED,True,30090,4054,53,https://github.com/mdsitton,"Clean up the cmake build system, and get it building on linux.",9,[],https://github.com/NovaMods/nova-renderer/pull/9,https://github.com/mdsitton,9,https://github.com/NovaMods/nova-renderer/pull/9#issuecomment-228142732,Building on windows needs to be tested though. This will fix issue #6.,"Well currently i have an issue on Arch Linux that i'm not certain if its a problem with the cmake config or a bug with the build configuration on an arch library. So i need to spin up a VM of another distro and test it there to figure out which it is. It still needs to be tested on MinGW. I need to add the libarchive dependency still.
I wish i could also figure out the exporting issues on windows as well, but thats going to require a redesign of all of the classes. or to define a set of api classes that should be simple and doesn't have any STL stuff used externally.
So the main issues i can probably finish in a day. I'm off work for the weekend after tonight so i'll have more time to work on it again.",True,{}
NovaMods/nova-renderer,https://github.com/NovaMods/nova-renderer,11,2016-09-18T17:57:24Z,2016-09-18T17:57:51Z,2016-09-18T17:57:51Z,MERGED,True,8388,838,48,https://github.com/DethRaid,Powershell script now downloads dependencies and applies patches,16,[],https://github.com/NovaMods/nova-renderer/pull/11,https://github.com/DethRaid,1,https://github.com/NovaMods/nova-renderer/pull/11,,,True,{}
NovaMods/nova-renderer,https://github.com/NovaMods/nova-renderer,12,2016-09-20T00:17:15Z,2016-09-20T00:17:19Z,2016-09-20T00:17:19Z,MERGED,True,33,31,4,https://github.com/DethRaid,Fixed some compile errors,1,[],https://github.com/NovaMods/nova-renderer/pull/12,https://github.com/DethRaid,1,https://github.com/NovaMods/nova-renderer/pull/12,,,True,{}
NovaMods/nova-renderer,https://github.com/NovaMods/nova-renderer,13,2016-09-21T00:27:40Z,2016-09-21T00:27:46Z,2016-09-21T00:27:46Z,MERGED,True,19,15,14,https://github.com/DethRaid,"Created view folder, fixed JNA library path thing",3,[],https://github.com/NovaMods/nova-renderer/pull/13,https://github.com/DethRaid,1,https://github.com/NovaMods/nova-renderer/pull/13,,,True,{}
NovaMods/nova-renderer,https://github.com/NovaMods/nova-renderer,18,2017-01-03T15:17:59Z,2017-01-03T15:18:13Z,2017-01-03T18:45:29Z,MERGED,True,4157,1773,109,https://github.com/DethRaid,Massive refactor,51,[],https://github.com/NovaMods/nova-renderer/pull/18,https://github.com/DethRaid,1,https://github.com/NovaMods/nova-renderer/pull/18,Performing a massive refactor to increase code organization and ease of modification,Performing a massive refactor to increase code organization and ease of modification,True,{}
NovaMods/nova-renderer,https://github.com/NovaMods/nova-renderer,21,2017-01-29T15:36:12Z,2017-01-29T18:05:12Z,2017-01-29T18:05:12Z,MERGED,True,458,1921,21,https://github.com/Maximilian-Reuter,"Implemented Mouse Handling, though no scrolling yet",6,[],https://github.com/NovaMods/nova-renderer/pull/21,https://github.com/Maximilian-Reuter,1,https://github.com/NovaMods/nova-renderer/pull/21,"this pr implements mouse handling, and as an added bonus, disabled buttons are actually drawn disabled","this pr implements mouse handling, and as an added bonus, disabled buttons are actually drawn disabled",True,{}
NovaMods/nova-renderer,https://github.com/NovaMods/nova-renderer,22,2017-01-29T18:08:21Z,2017-01-29T18:12:28Z,2017-01-29T18:34:48Z,MERGED,True,0,46,1,https://github.com/Maximilian-Reuter,cleaned up Mouse.java to remove unnecessary whitespace and old code,1,[],https://github.com/NovaMods/nova-renderer/pull/22,https://github.com/Maximilian-Reuter,1,https://github.com/NovaMods/nova-renderer/pull/22,,,True,{}
NovaMods/nova-renderer,https://github.com/NovaMods/nova-renderer,23,2017-01-29T19:55:46Z,2017-01-29T20:03:26Z,2017-01-29T20:03:26Z,MERGED,True,47,11,4,https://github.com/tobiasschulz,Fix Linux build,2,[],https://github.com/NovaMods/nova-renderer/pull/23,https://github.com/tobiasschulz,1,https://github.com/NovaMods/nova-renderer/pull/23,,,True,{}
NovaMods/nova-renderer,https://github.com/NovaMods/nova-renderer,24,2017-01-29T21:42:38Z,2017-01-29T22:15:26Z,2017-01-29T22:15:26Z,MERGED,True,21,25,3,https://github.com/tobiasschulz,Create patch with git diff,5,[],https://github.com/NovaMods/nova-renderer/pull/24,https://github.com/tobiasschulz,1,https://github.com/NovaMods/nova-renderer/pull/24,,,True,{}
NovaMods/nova-renderer,https://github.com/NovaMods/nova-renderer,25,2017-02-02T05:53:10Z,2017-02-02T06:08:36Z,2017-02-04T03:41:07Z,MERGED,True,509,436,26,https://github.com/DethRaid,Gui text,9,[],https://github.com/NovaMods/nova-renderer/pull/25,https://github.com/DethRaid,1,https://github.com/NovaMods/nova-renderer/pull/25,GUI text now renders very nicely,GUI text now renders very nicely,True,{}
NovaMods/nova-renderer,https://github.com/NovaMods/nova-renderer,26,2017-02-02T06:29:38Z,2017-02-02T12:48:44Z,2017-02-04T03:36:29Z,MERGED,True,1467,164,12,https://github.com/tobiasschulz,Runnable jar,26,[],https://github.com/NovaMods/nova-renderer/pull/26,https://github.com/tobiasschulz,1,https://github.com/NovaMods/nova-renderer/pull/26,,,True,{}
NovaMods/nova-renderer,https://github.com/NovaMods/nova-renderer,26,2017-02-02T06:29:38Z,2017-02-02T12:48:44Z,2017-02-04T03:36:29Z,MERGED,True,1467,164,12,https://github.com/tobiasschulz,Runnable jar,26,[],https://github.com/NovaMods/nova-renderer/pull/26,https://github.com/dotModded,2,https://github.com/NovaMods/nova-renderer/pull/26#issuecomment-276883039,,This a large pr..,True,{}
NovaMods/nova-renderer,https://github.com/NovaMods/nova-renderer,26,2017-02-02T06:29:38Z,2017-02-02T12:48:44Z,2017-02-04T03:36:29Z,MERGED,True,1467,164,12,https://github.com/tobiasschulz,Runnable jar,26,[],https://github.com/NovaMods/nova-renderer/pull/26,https://github.com/tobiasschulz,3,https://github.com/NovaMods/nova-renderer/pull/26#issuecomment-276894532,,"Not really just a lot of commits, and half of the changed lines is the patch file",True,{}
NovaMods/nova-renderer,https://github.com/NovaMods/nova-renderer,27,2017-02-03T00:24:57Z,2017-02-03T01:10:35Z,2017-02-03T01:17:51Z,MERGED,True,118,66,9,https://github.com/tobiasschulz,Crash fix,7,[],https://github.com/NovaMods/nova-renderer/pull/27,https://github.com/tobiasschulz,1,https://github.com/NovaMods/nova-renderer/pull/27,,,True,{}
NovaMods/nova-renderer,https://github.com/NovaMods/nova-renderer,27,2017-02-03T00:24:57Z,2017-02-03T01:10:35Z,2017-02-03T01:17:51Z,MERGED,True,118,66,9,https://github.com/tobiasschulz,Crash fix,7,[],https://github.com/NovaMods/nova-renderer/pull/27,https://github.com/tobiasschulz,2,https://github.com/NovaMods/nova-renderer/pull/27#issuecomment-277132780,,"the real problem was the unsigned short thing
then your fix was buggy because of that remove_if misunderstanding
not using raw pointers for ""render_object"" and ""gl_mesh"" is cleaner

but using a smart pointer for ""gl_mesh"" ensures that nothing brakes if ""render_object"" is copied by value for whatever reason


another problem is the inconsistency of the texture names. Maximilian suggested that ""texture/"" and "".png"" should be removed before atlas lookup",True,{}
NovaMods/nova-renderer,https://github.com/NovaMods/nova-renderer,28,2017-02-04T03:46:39Z,2017-02-04T16:05:57Z,2017-02-04T16:06:01Z,MERGED,True,279,64,24,https://github.com/Maximilian-Reuter,Window resize,13,[],https://github.com/NovaMods/nova-renderer/pull/28,https://github.com/Maximilian-Reuter,1,https://github.com/NovaMods/nova-renderer/pull/28,,,True,{}
NovaMods/nova-renderer,https://github.com/NovaMods/nova-renderer,29,2017-02-07T14:04:13Z,2017-02-07T15:39:40Z,2017-02-07T15:39:43Z,MERGED,True,224,239,19,https://github.com/DethRaid,World selection,5,[],https://github.com/NovaMods/nova-renderer/pull/29,https://github.com/DethRaid,1,https://github.com/NovaMods/nova-renderer/pull/29,"Got the world selection screen mostly working. There's also two major changes to our APIs:

NovaDraw#drawRect now takes in two Rectangle.Float objects: one for the rectangle to draw and one for that rectangle's UV coordinates. I don't like having large numbers of parameters, especially not when many of them are of the same type
Nova now identifies textures by string name, and not by the texture_type enum. This allows for textures that we did not expect, such as the icon for the world you're selecting or textures that shaderpack authors define","Got the world selection screen mostly working. There's also two major changes to our APIs:

NovaDraw#drawRect now takes in two Rectangle.Float objects: one for the rectangle to draw and one for that rectangle's UV coordinates. I don't like having large numbers of parameters, especially not when many of them are of the same type
Nova now identifies textures by string name, and not by the texture_type enum. This allows for textures that we did not expect, such as the icon for the world you're selecting or textures that shaderpack authors define",True,{}
NovaMods/nova-renderer,https://github.com/NovaMods/nova-renderer,30,2017-02-07T18:07:22Z,2017-02-07T23:42:13Z,2017-02-07T23:44:11Z,MERGED,True,358,262,15,https://github.com/Maximilian-Reuter,Working background,13,[],https://github.com/NovaMods/nova-renderer/pull/30,https://github.com/Maximilian-Reuter,1,https://github.com/NovaMods/nova-renderer/pull/30,,,True,{}
NovaMods/nova-renderer,https://github.com/NovaMods/nova-renderer,31,2017-02-08T12:55:37Z,2017-02-08T13:48:08Z,2017-02-08T13:48:52Z,MERGED,True,27,3,1,https://github.com/Maximilian-Reuter,added modelmatrix to perform transformation on vertices,1,[],https://github.com/NovaMods/nova-renderer/pull/31,https://github.com/Maximilian-Reuter,1,https://github.com/NovaMods/nova-renderer/pull/31,,,True,{}
NovaMods/nova-renderer,https://github.com/NovaMods/nova-renderer,32,2017-02-08T21:32:51Z,2017-02-08T21:35:36Z,2017-02-08T21:35:44Z,MERGED,True,0,0,1,https://github.com/DethRaid,Updated patch file,1,[],https://github.com/NovaMods/nova-renderer/pull/32,https://github.com/DethRaid,1,https://github.com/NovaMods/nova-renderer/pull/32,,,True,{}
NovaMods/nova-renderer,https://github.com/NovaMods/nova-renderer,43,2017-06-22T02:21:26Z,2017-06-22T02:31:29Z,2017-06-22T02:31:29Z,CLOSED,False,11,297,7,https://github.com/ckissane,Fix Those Includes!,2,[],https://github.com/NovaMods/nova-renderer/pull/43,https://github.com/ckissane,1,https://github.com/NovaMods/nova-renderer/pull/43,!,!,True,{}
NovaMods/nova-renderer,https://github.com/NovaMods/nova-renderer,43,2017-06-22T02:21:26Z,2017-06-22T02:31:29Z,2017-06-22T02:31:29Z,CLOSED,False,11,297,7,https://github.com/ckissane,Fix Those Includes!,2,[],https://github.com/NovaMods/nova-renderer/pull/43,https://github.com/ckissane,2,https://github.com/NovaMods/nova-renderer/pull/43#issuecomment-310257736,!,Oh srry,True,{}
NovaMods/nova-renderer,https://github.com/NovaMods/nova-renderer,44,2017-06-22T02:33:28Z,2017-06-22T02:42:28Z,2017-06-22T02:42:28Z,CLOSED,False,11,297,7,https://github.com/ckissane,Fix Includes And Put Back Normal Shaders,2,[],https://github.com/NovaMods/nova-renderer/pull/44,https://github.com/ckissane,1,https://github.com/NovaMods/nova-renderer/pull/44,The endings NEED to be changed,The endings NEED to be changed,True,{}
NovaMods/nova-renderer,https://github.com/NovaMods/nova-renderer,45,2017-06-22T02:53:04Z,2017-06-22T14:03:34Z,2017-06-22T14:03:34Z,CLOSED,False,11,5,7,https://github.com/ckissane,Fix The Shaders And Includes,9,[],https://github.com/NovaMods/nova-renderer/pull/45,https://github.com/ckissane,1,https://github.com/NovaMods/nova-renderer/pull/45,Did It!,Did It!,True,{}
NovaMods/nova-renderer,https://github.com/NovaMods/nova-renderer,45,2017-06-22T02:53:04Z,2017-06-22T14:03:34Z,2017-06-22T14:03:34Z,CLOSED,False,11,5,7,https://github.com/ckissane,Fix The Shaders And Includes,9,[],https://github.com/NovaMods/nova-renderer/pull/45,https://github.com/ckissane,2,https://github.com/NovaMods/nova-renderer/pull/45#issuecomment-310384668,Did It!,nothing is broken,True,{}
NovaMods/nova-renderer,https://github.com/NovaMods/nova-renderer,46,2017-06-22T18:05:10Z,2017-06-22T18:28:36Z,2017-06-22T18:28:36Z,MERGED,True,70772,2556,100,https://github.com/DethRaid,Chunks,57,['enhancement'],https://github.com/NovaMods/nova-renderer/pull/46,https://github.com/DethRaid,1,https://github.com/NovaMods/nova-renderer/pull/46,"Basic chunk rendering. Chunks are drawn textured
Problems:

Everything is a block
Grass and flowers and whatnot don't work very well
Pausing the game causes Minecraft to still receive mouse input, so the camera moves a lot
Chunk loading is too slow","Basic chunk rendering. Chunks are drawn textured
Problems:

Everything is a block
Grass and flowers and whatnot don't work very well
Pausing the game causes Minecraft to still receive mouse input, so the camera moves a lot
Chunk loading is too slow",True,"{'HOORAY': ['https://github.com/parlough', 'https://github.com/skmedix']}"
NovaMods/nova-renderer,https://github.com/NovaMods/nova-renderer,47,2017-06-22T22:57:09Z,2017-06-22T23:14:30Z,2017-06-23T12:11:27Z,MERGED,True,167,8,12,https://github.com/ckissane,Water Shaders,12,[],https://github.com/NovaMods/nova-renderer/pull/47,https://github.com/ckissane,1,https://github.com/NovaMods/nova-renderer/pull/47,Added Water Shaders,Added Water Shaders,True,{}
NovaMods/nova-renderer,https://github.com/NovaMods/nova-renderer,48,2017-06-23T02:23:35Z,2017-06-23T03:32:14Z,2017-06-23T03:32:14Z,MERGED,True,30,6,2,https://github.com/ckissane,Removal Of inner faces of transparent groups,3,['enhancement'],https://github.com/NovaMods/nova-renderer/pull/48,https://github.com/ckissane,1,https://github.com/NovaMods/nova-renderer/pull/48,,,True,{}
NovaMods/nova-renderer,https://github.com/NovaMods/nova-renderer,54,2017-08-03T12:57:53Z,2017-08-03T13:12:34Z,2017-08-03T13:12:41Z,MERGED,True,7,2,1,https://github.com/willi123yao,Added Linux patch options,2,[],https://github.com/NovaMods/nova-renderer/pull/54,https://github.com/willi123yao,1,https://github.com/NovaMods/nova-renderer/pull/54,Support 'applyPatch' for linux using 'patch' command,Support 'applyPatch' for linux using 'patch' command,True,{}
NovaMods/nova-renderer,https://github.com/NovaMods/nova-renderer,54,2017-08-03T12:57:53Z,2017-08-03T13:12:34Z,2017-08-03T13:12:41Z,MERGED,True,7,2,1,https://github.com/willi123yao,Added Linux patch options,2,[],https://github.com/NovaMods/nova-renderer/pull/54,https://github.com/tobiasschulz,2,https://github.com/NovaMods/nova-renderer/pull/54#issuecomment-319962286,Support 'applyPatch' for linux using 'patch' command,For windows there is ${project.projectDir} in both paths. For linux the relative paths are just hardcoded. Are you sure that works?,True,{}
NovaMods/nova-renderer,https://github.com/NovaMods/nova-renderer,54,2017-08-03T12:57:53Z,2017-08-03T13:12:34Z,2017-08-03T13:12:41Z,MERGED,True,7,2,1,https://github.com/willi123yao,Added Linux patch options,2,[],https://github.com/NovaMods/nova-renderer/pull/54,https://github.com/willi123yao,3,https://github.com/NovaMods/nova-renderer/pull/54#issuecomment-319963051,Support 'applyPatch' for linux using 'patch' command,"Well technically it was using relative paths in nova.sh also, which is the current install script",True,{}
NovaMods/nova-renderer,https://github.com/NovaMods/nova-renderer,58,2017-08-09T11:46:17Z,2017-08-09T11:48:02Z,2017-08-09T11:48:55Z,CLOSED,False,19721,3198,73,https://github.com/Flandyn,Fix MCP download error,44,[],https://github.com/NovaMods/nova-renderer/pull/58,https://github.com/Flandyn,1,https://github.com/NovaMods/nova-renderer/pull/58,"Fixes the ""Exception calling ""DownloadFile"" with ""2"" argument(s): ""The remote server returned an error: (404) Not Found."""" error that occurs trying to download the MCP
EDIT: Merged with wrong branch, fixed","Fixes the ""Exception calling ""DownloadFile"" with ""2"" argument(s): ""The remote server returned an error: (404) Not Found."""" error that occurs trying to download the MCP
EDIT: Merged with wrong branch, fixed",True,{}
NovaMods/nova-renderer,https://github.com/NovaMods/nova-renderer,59,2017-08-09T11:47:11Z,2017-08-09T12:55:25Z,2017-08-09T12:55:25Z,MERGED,True,2,2,2,https://github.com/Flandyn,Fix MCP download error,2,[],https://github.com/NovaMods/nova-renderer/pull/59,https://github.com/Flandyn,1,https://github.com/NovaMods/nova-renderer/pull/59,"Fixes the ""Exception calling ""DownloadFile"" with ""2"" argument(s): ""The remote server returned an error: (404) Not Found."""" error that occurs trying to download the MCP","Fixes the ""Exception calling ""DownloadFile"" with ""2"" argument(s): ""The remote server returned an error: (404) Not Found."""" error that occurs trying to download the MCP",True,{}
NovaMods/nova-renderer,https://github.com/NovaMods/nova-renderer,59,2017-08-09T11:47:11Z,2017-08-09T12:55:25Z,2017-08-09T12:55:25Z,MERGED,True,2,2,2,https://github.com/Flandyn,Fix MCP download error,2,[],https://github.com/NovaMods/nova-renderer/pull/59,https://github.com/rayzr522,2,https://github.com/NovaMods/nova-renderer/pull/59#issuecomment-321234024,"Fixes the ""Exception calling ""DownloadFile"" with ""2"" argument(s): ""The remote server returned an error: (404) Not Found."""" error that occurs trying to download the MCP","If you do go through with this PR, don't forget to change the Unix installer script too.",True,{}
